Document_ID,Risk_Score,Top_Topic,Text
3681,1.7024,4,"Stupid.its not possible"
3687,1.7024,4,"Wake me up at  &lt;#&gt;  am morning:)"
3694,1.7024,4,"No i am not having not any movies in my laptop"
3700,1.7024,4,"S:)but he had some luck.2 catches put down:)"
3707,1.7024,4,"Ok. Very good. Its all about making that money."
3708,1.7024,4,"Reading gud habit.. Nan bari hudgi yorge pataistha ertini kano:-)"
3712,1.7024,4,"ARE YOU IN TOWN? THIS IS V. IMPORTANT"
3718,1.7024,4,"Networking technical support associate."
3735,1.7024,4,"Old Orchard near univ. How about you?"
3738,1.7024,4,"Hows the street where the end of library walk is?"
3741,1.7024,4,"Did you stitch his trouser"
3743,1.7024,4,"2/2 146tf150p"
3748,1.7024,4,"I'm not. She lip synced with shangela."
3753,1.7024,4,"Haha... Sounds crazy, dunno can tahan anot..."
3755,1.7024,4,"Ya that one is slow as poo"
3757,1.7024,4,"Im on gloucesterroad what are uup to later?"
3776,1.7024,4,"Ok... But bag again.."
3785,1.7024,4,"Can you do online transaction?"
3789,1.7024,4,"WHORE YOU ARE UNBELIEVABLE."
3804,1.7024,4,"No da. I am happy that we sit together na"
3807,1.7024,4,"Dude while were makin those weirdy brownies my sister made awesome cookies. I took pics."
3819,1.7024,4,"This is my number by vivek.."
3821,1.7024,4,"sorry brah, just finished the last of my exams, what up"
3824,1.7024,4,"Just normal only here :)"
3834,1.7024,4,"Ok."
3837,1.7024,4,"I'm thinking that chennai forgot to come for auction.."
3838,1.7024,4,"Then ü come n pick me at 530 ar?"
3851,1.7024,4,"U in town alone?"
3852,1.7024,4,"I to am looking forward to all the sex cuddling.. Only two more sleeps"
3853,1.7024,4,"We have all rounder:)so not required:)"
3854,1.7024,4,"No, its true..k,Do u knw dis no. &lt;#&gt; ?"
3875,1.7024,4,"Happy or sad , one thing about past is- ""Its no more"" GOOD MORNING :-):-)."
3889,1.7024,4,"Cab is available.they pick up and drop at door steps."
3902,1.7024,4,"Okie"
3909,1.7024,4,"No that just means you have a fat head"
3918,1.7024,4,"Ok. C u then."
3935,1.7024,4,"Playin space poker, u?"
3941,1.7024,4,"Y ü wan to go there? C doctor?"
3942,1.7024,4,"Does daddy have a bb now."
3957,1.7024,4,"I knew it... U slept v late yest? Wake up so late..."
3962,1.7024,4,"I sent lanre fakeye's Eckankar details to the mail box"
3974,1.7024,4,"WOT U UP 2 J?"
3982,1.7024,4,"ringtoneking 84484"
3983,1.7024,4,"Huh i cant thk of more oredi how many pages do we have?"
3997,1.7024,4,"R u in this continent?"
4014,1.7024,4,"Discussed with your mother ah?"
4015,1.7024,4,"Ok."
4022,1.7024,4,"University of southern california."
4023,1.7024,4,"We have to pick rayan macleran there."
4027,1.7024,4,"&lt;#&gt;  in mca. But not conform."
4031,1.7024,4,"[…] anyway, many good evenings to u! s"
4034,1.7024,4,"I'm very happy for you babe ! Woo hoo party on dude!"
4035,1.7024,4,"I am taking you for italian food. How about a pretty dress with no panties? :)"
4038,1.7024,4,"How are you holding up?"
4064,1.7024,4,"Hi dear we saw dear. We both are happy. Where you my battery is low"
4065,1.7024,4,"How are you. Its been ages. How's abj"
4066,1.7024,4,"Prof: you have passed in all the papers in this sem congrats . . . . Student: Enna kalaachutaarama..!! Prof:???? Gud mrng!"
4075,1.7024,4,"Was the actual exam harder than NBME"
4080,1.7024,4,"Gam gone after outstanding innings."
4081,1.7024,4,"O i played smash bros  &lt;#&gt;  religiously."
4094,1.7024,4,"I remain unconvinced that this isn't an elaborate test of my willpower"
4108,1.7024,4,"K then 2marrow are you coming to class."
4118,1.7024,4,"What you doing?how are you?"
4123,1.7024,4,"Yunny... I'm goin to be late"
4127,1.7024,4,"May b approve panalam...but it should have more posts.."
4136,1.7024,4,"Is it your yahoo boys that bring in the perf? Or legal."
4138,1.7024,4,"have you ever had one foot before?"
4153,1.7024,4,"Ü comin to fetch us oredi..."
4154,1.7024,4,"What's nannys address?"
4162,1.7024,4,"i felt so...not any conveying reason.. Ese he... What about me?"
4165,1.7024,4,"I told that am coming on wednesday."
4180,1.7024,4,"Two teams waiting for some players"
4187,1.7024,4,"I'm good. Have you registered to vote?"
4194,1.7024,4,"&lt;#&gt;  w jetton ave if you forgot"
4196,1.7024,4,"Can not use foreign stamps in this country."
4215,1.7024,4,"I attended but nothing is there."
4217,1.7024,4,"No dear i was sleeping :-P"
4218,1.7024,4,"Er mw im filled tuth is aight"
4225,1.7024,4,"Stupid auto correct on my phone"
4230,1.7024,4,"Have you started in skye"
4232,1.7024,4,"And several to you sir."
4245,1.7024,4,"Okie..."
4247,1.7024,4,"Is toshiba portege m100 gd?"
4252,1.7024,4,"How much for an eighth?"
4256,1.7024,4,"How about clothes, jewelry, and trips?"
4260,1.7024,4,"I am late. I will be there at"
4262,1.7024,4,"Are you plans with your family set in stone ?"
4268,1.7024,4,"The greatest test of courage on earth is to bear defeat without losing heart....gn tc"
4276,1.7024,4,"Ball is moving a lot.will spin in last :)so very difficult to bat:)"
4279,1.7024,4,"I'm glad. You are following your dreams."
4283,1.7024,4,"Wn u r hurt by d prsn who s close 2 u, do fight wit dem. Coz somtimes dis fight saves a relation bt being quiet leaves nothin in a relation.. Gud eveB-)"
4287,1.7024,4,"I pocked you up there before"
4291,1.7024,4,"Okay, good, no problem, and thanx!"
4294,1.7024,4,"G.W.R"
4296,1.7024,4,"Kit Strip - you have been billed 150p. Netcollex Ltd. PO Box 1013 IG11 OJA"
4306,1.7024,4,"Good good, billy mates all gone. Just been jogging, again! Did enjoy concert?"
4309,1.7024,4,"I guess it is useless calling u 4 something important."
4314,1.7024,4,"I keep ten rs in my shelf:) buy two egg."
4326,1.7024,4,"I am not having her number sir"
4328,1.7024,4,"That seems unnecessarily hostile"
4332,1.7024,4,"i thought we were doing a king of the hill thing there."
4333,1.7024,4,"Nope i'll come online now.."
4339,1.7024,4,"on a Tuesday night r u 4 real"
4346,1.7024,4,"Hi:)did you asked to waheeda fathima about leave?"
4347,1.7024,4,"Enjoy urself tmr..."
4354,1.7024,4,"Hows the pain dear?y r u smiling?"
4367,1.7024,4,"Ujhhhhhhh computer shipped out with address to sandiago and parantella lane. Wtf. Poop."
4379,1.7024,4,"How much is torch in 9ja."
4381,1.7024,4,"How are you. Just checking up on you"
4383,1.7024,4,"Mathews or tait or edwards or anderson"
4391,1.7024,4,"K I'm ready,  &lt;#&gt; ?"
4393,1.7024,4,"The greatest test of courage on earth is to bear defeat without losing heart....gn tc"
4394,1.7024,4,"what are your new years plans?"
4402,1.7024,4,"Juz go google n search 4 qet..."
4424,1.7024,4,"MMM ... Fuck .... Merry Christmas to me"
4428,1.7024,4,"Was it something u ate?"
4433,1.7024,4,"2mro i am not coming to gym machan. Goodnight."
4448,1.7024,4,"Merry christmas to u too annie!"
4452,1.7024,4,"Awesome, be there in a minute"
4455,1.7024,4,"Or I guess  &lt;#&gt;  min"
4466,1.7024,4,"Ranjith cal drpd Deeraj and deepak 5min hold"
4467,1.7024,4,"CHEERS FOR CALLIN BABE.SOZI CULDNT TALKBUT I WANNATELL U DETAILS LATER WENWECAN CHAT PROPERLY X"
4469,1.7024,4,"She said,'' do u mind if I go into the bedroom for a minute ? '' ''OK'', I sed in a sexy mood. She came out 5 minuts latr wid a cake...n My Wife,"
4473,1.7024,4,"Wa... U so efficient... Gee... Thanx..."
4475,1.7024,4,"S but not able to sleep."
4481,1.7024,4,"Erutupalam thandiyachu"
4483,1.7024,4,"No..its ful of song lyrics.."
4486,1.7024,4,"Shopping? Eh ger i toking abt syd leh...Haha"
4487,1.7024,4,"What not under standing."
4492,1.7024,4,"My computer just fried the only essential part we don't keep spares of because my fucking idiot roommates looovvve leaving the thing running on full  &lt;#&gt; /7"
4499,1.7024,4,"Ok"
4504,1.7024,4,"Wot is u up 2 then bitch?"
4505,1.7024,4,"Stupid.its not possible"
4508,1.7024,4,"When are you guys leaving?"
4514,1.7024,4,"Now project pa. After that only i can come."
4517,1.7024,4,"That was random saw my old roomate on campus. He graduated"
4523,1.7024,4,"Hi good mornin.. Thanku wish u d same.."
4526,1.7024,4,"I've sent ü my part.."
4536,1.7024,4,"I have no money 4 steve mate! !"
4539,1.7024,4,"Normally i use to drink more water daily:)"
4558,1.7024,4,"Gettin rdy to ship comp"
4562,1.7024,4,"I'm awake oh. What's up."
4569,1.7024,4,"But you were together so you should be thinkin about him"
4576,1.7024,4,":( but your not here...."
4577,1.7024,4,"Not directly behind... Abt 4 rows behind ü..."
4581,1.7024,4,"No plans yet. What are you doing ?"
4597,1.7024,4,"Yo sorry was in the shower sup"
4599,1.7024,4,"Full heat pa:-) i have applyed oil pa."
4601,1.7024,4,"Have you laid your airtel line to rest?"
4606,1.7024,4,"THANX 4 PUTTIN DA FONE DOWN ON ME!!"
4609,1.7024,4,"Been running but only managed 5 minutes and then needed oxygen! Might have to resort to the roller option!"
4612,1.7024,4,"Just glad to be talking to you."
4618,1.7024,4,"Ü called dad oredi..."
4622,1.7024,4,"THIS IS A LONG FUCKIN SHOWR"
4623,1.7024,4,"Received, understood n acted upon!"
4624,1.7024,4,"They finally came to fix the ceiling."
4636,1.7024,4,"These won't do. Have to move on to morphine"
4640,1.7024,4,"Captain vijaykanth is doing comedy in captain tv..he is drunken :)"
4642,1.7024,4,"Do you hide anythiing or keeping distance from me"
4643,1.7024,4,"Havent."
4645,1.7024,4,"Sorry i din lock my keypad."
4647,1.7024,4,"Are you planning to come chennai?"
4652,1.7024,4,"Finally it has happened..! Aftr decades..! BEER is now cheaper than PETROL! The goverment expects us to ""DRINK"". . . But don't ""DRIVE """
4654,1.7024,4,"Where r e meeting tmr?"
4657,1.7024,4,"Our Prasanth ettans mother passed away last night. Just pray for her and family."
4663,1.7024,4,"Ok no prob..."
4670,1.7024,4,"IM REALY SOZ IMAT MY MUMS 2NITE WHAT ABOUT 2MORO"
4676,1.7024,4,"I'm leaving my house now."
4679,1.7024,4,"Wewa is 130. Iriver 255. All 128 mb."
4683,1.7024,4,"Are you staying in town ?"
4692,1.7024,4,"Ok no prob"
4693,1.7024,4,"Surly ill give it to you:-) while coming to review."
4700,1.7024,4,"Don no da:)whats you plan?"
4704,1.7024,4,"Anytime..."
4709,1.7024,4,"Wif my family booking tour package."
4714,1.7024,4,"Thats cool princess! I will cover your face in hot sticky cum :)"
4733,1.7024,4,"K:)eng rocking in ashes:)"
4737,1.7024,4,"Oh k:)after that placement there ah?"
4744,1.7024,4,"Ya very nice. . .be ready on thursday"
4746,1.7024,4,"Thinking of u ;) x"
4765,1.7024,4,"Prepare to be pleasured :)"
4768,1.7024,4,"Whens your radio show?"
4788,1.7024,4,"Holy living christ what is taking you so long"
4791,1.7024,4,"We're on the opposite side from where we dropped you off"
4794,1.7024,4,"Gd luck 4 ur exams :-)"
4796,1.7024,4,"Sorry that was my uncle. I.ll keep in touch"
4804,1.7024,4,"Reverse is cheating. That is not mathematics."
4805,1.7024,4,"How do you plan to manage that"
4820,1.7024,4,"How's ur paper?"
4823,1.7024,4,"Im good! I have been thinking about you..."
4825,1.7024,4,":-) :-)"
4826,1.7024,4,"Not thought bout it... || Drink in tap & spile at seven. || Is that pub on gas st off broad st by canal. || Ok?"
4828,1.7024,4,"Haha, just what I was thinkin"
4841,1.7024,4,"That's one of the issues but california is okay. No snow so its manageable"
4847,1.7024,4,"Missing you too.pray inshah allah"
4854,1.7024,4,"I liked your new house"
4857,1.7024,4,"Same to u..."
4860,1.7024,4,"Ok..."
4871,1.7024,4,"1. Tension face 2. Smiling face 3. Waste face 4. Innocent face 5.Terror face 6.Cruel face 7.Romantic face 8.Lovable face 9.decent face  &lt;#&gt; .joker face."
4883,1.7024,4,"When/where do I pick you up"
4896,1.7024,4,"Convey my regards to him"
4905,1.7024,4,"I;m reaching in another 2 stops."
4915,1.7024,4,"Goal! Arsenal 4 (Henry, 7 v Liverpool 2 Henry scores with a simple shot from 6 yards from a pass by Bergkamp to give Arsenal a 2 goal margin after 78 mins."
4925,1.7024,4,"Oh yah... We never cancel leh... Haha"
4926,1.7024,4,"We can go 4 e normal pilates after our intro..."
4929,1.7024,4,"Wanna do some art?! :D"
4934,1.7024,4,"Match started.india  &lt;#&gt;  for 2"
4938,1.7024,4,"K..k.:)congratulation .."
4957,1.7024,4,"Doing my masters. When will you buy a bb cos i have for sale and how's bf"
4967,1.7024,4,"A few people are at the game, I'm at the mall with iouri and kaila"
4983,1.7024,4,"I said its okay. Sorry"
4985,1.7024,4,"Networking job is there."
4988,1.7024,4,"That's y u haf 2 keep me busy..."
4989,1.7024,4,"No rushing. I'm not working. I'm in school so if we rush we go hungry."
4990,1.7024,4,"Which channel:-):-):):-)."
5001,1.7024,4,"Hmph. Go head, big baller."
5003,1.7024,4,"Nope. Since ayo travelled, he has forgotten his guy"
5007,1.7024,4,"Guess which pub im in? Im as happy as a pig in clover or whatever the saying is!"
5023,1.7024,4,":-( sad puppy noise"
5026,1.7024,4,"Where you. What happen"
5030,1.7024,4,"Go chase after her and run her over while she's crossing the street"
5039,1.7024,4,"(You didn't hear it from me)"
5052,1.7024,4,"I will vote for wherever my heart guides me"
5065,1.7024,4,"Ok i also wan 2 watch e 9 pm show..."
5073,1.7024,4,"As in different styles?"
5091,1.7024,4,"St andre, virgil's cream"
5094,1.7024,4,"Gokila is talking with you aha:)"
5107,1.7024,4,"Ding me on ya break fassyole! Blacko from londn"
5109,1.7024,4,"The sign of maturity is not when we start saying big things.. But actually it is, when we start understanding small things... *HAVE A NICE EVENING* BSLVYL"
5115,1.7024,4,"Argh why the fuck is nobody in town ;_;"
5118,1.7024,4,"Aslamalaikkum....insha allah tohar beeen muht albi mufti mahfuuz...meaning same here...."
5119,1.7024,4,"Are you driving or training?"
5121,1.7024,4,"PRIVATE! Your 2003 Account Statement for 078"
5122,1.7024,4,"Oops I did have it,  &lt;#&gt; ?"
5128,1.7024,4,"Cuz ibored. And don wanna study"
5129,1.7024,4,"Wot about on wed nite I am 3 then but only til 9!"
5136,1.7024,4,"Sorry * was at the grocers."
5137,1.7024,4,"There are some nice pubs near here or there is Frankie n Bennys near the warner cinema?"
5145,1.7024,4,"I'm in office now da:)where are you?"
5160,1.7024,4,"No but the bluray player can"
5161,1.7024,4,"Ok... Then r we meeting later?"
5174,1.7024,4,"U 2."
5175,1.7024,4,"Water logging in desert. Geoenvironmental implications."
5186,1.7024,4,"I just cooked a rather nice salmon a la you"
5187,1.7024,4,"I uploaded mine to Facebook"
5189,1.7024,4,"Okie"
5194,1.7024,4,"It's wylie, you in tampa or sarasota?"
5200,1.7024,4,"Ugh my leg hurts. Musta overdid it on mon."
5211,1.7024,4,"Dai i downloaded but there is only exe file which i can only run that exe after installing."
5212,1.7024,4,"It is only yesterday true true."
5213,1.7024,4,"K.k.how is your business now?"
5216,1.7024,4,"I keep ten rs in my shelf:) buy two egg."
5217,1.7024,4,"I am late. I will be there at"
5223,1.7024,4,"5 nights...We nt staying at port step liao...Too ex"
5227,1.7024,4,"Prabha..i'm soryda..realy..frm heart i'm sory"
5236,1.7024,4,"Am on the uworld site. Am i buying the qbank only or am i buying it with the self assessment also?"
5242,1.7024,4,"Its a part of checking IQ"
5249,1.7024,4,"U come n search tat vid..not finishd.."
5259,1.7024,4,"1 in cbe. 2 in chennai."
5269,1.7024,4,"ER, ENJOYIN INDIANS AT THE MO..yeP. SaLL gOoD HehE ;> hows bout u shexy? Pete Xx"
5274,1.7024,4,"Its too late:)but its k.wish you the same."
5282,1.7024,4,"And how you will do that, princess? :)"
5294,1.7024,4,"I donno its in your genes or something"
5299,1.7024,4,"I.ll hand her my phone to chat wit u"
5308,1.7024,4,"What you did in  leave."
5316,1.7024,4,"Hahaha..use your brain dear"
5320,1.7024,4,"Kothi print out marandratha."
5324,1.7024,4,"Aah bless! How's your arm?"
5330,1.7024,4,"Sir, waiting for your letter."
5331,1.7024,4,"Dude im no longer a pisces. Im an aquarius now."
5335,1.7024,4,"Garbage bags, eggs, jam, bread, hannaford wheat chex"
5338,1.7024,4,"My birthday is on feb  &lt;#&gt;  da. ."
5339,1.7024,4,"So when do you wanna gym?"
5341,1.7024,4,"Are u awake? Is there snow there?"
5345,1.7024,4,"When you guys planning on coming over?"
5351,1.7024,4,"No one interested. May be some business plan."
5356,1.7024,4,"Living is very simple.. Loving is also simple.. Laughing is too simple.. Winning is tooo simple.. But, Being 'SIMPLE' is very difficult...;-) :-)"
5358,1.7024,4,"Ok"
5373,1.7024,4,"Ok., is any problem to u frm him? Wats matter?"
5380,1.7024,4,"Somebody set up a website where you can play hold em using eve online spacebucks"
5381,1.7024,4,"Its sunny in california. The weather's just cool"
5389,1.7024,4,"NOT MUCH NO FIGHTS. IT WAS A GOOD NITE!!"
5398,1.7024,4,"That's necessarily respectful"
5400,1.7024,4,"And he's apparently bffs with carly quick now"
5407,1.7024,4,"Dear are you angry i was busy dear"
5409,1.7024,4,"... Are you in the pub?"
5413,1.7024,4,"Gr8. So how do you handle the victoria island traffic. Plus when's the album due"
5415,1.7024,4,"East coast"
5423,1.7024,4,"Ok k..sry i knw 2 siva..tats y i askd.."
5429,1.7024,4,"You didnt complete your gist oh."
5432,1.7024,4,"If I was I wasn't paying attention"
5438,1.7024,4,"Am slow in using biola's fne"
5454,1.7024,4,"Except theres a chick with huge boobs."
5458,1.7024,4,"Arun can u transfr me d amt"
5460,1.7024,4,"If you hear a loud scream in about &lt;#&gt; minutes its cause my Gyno will be shoving things up me that don't belong :/"
5464,1.7024,4,"U GOIN OUT 2NITE?"
5465,1.7024,4,"I will treasure every moment we spend together..."
5466,1.7024,4,"Shall I bring us a bottle of wine to keep us amused? Only joking! I‘ll bring one anyway"
5479,1.7024,4,"No probably  &lt;#&gt; %."
5487,1.7024,4,"Ofcourse I also upload some songs"
5489,1.7024,4,"K. I will sent it again"
5491,1.7024,4,"K. I will sent it again"
5499,1.7024,4,"Why did I wake up on my own &gt;:("
5503,1.7024,4,"Apo all other are mokka players only"
5511,1.7024,4,"I went to project centre"
5522,1.7024,4,"You are a big chic. Common. Declare"
5529,1.7024,4,"Its just the effect of irritation. Just ignore it"
5530,1.7024,4,"What about this one then."
5532,1.7024,4,"Compliments to you. Was away from the system. How your side."
5533,1.7024,4,"happened here while you were adventuring"
5535,1.7024,4,"Ok which your another number"
5540,1.7024,4,"Just sleeping..and surfing"
5554,1.7024,4,"Hahaha..use your brain dear"
5566,1.7024,4,"Huh y lei..."
5570,1.7024,4,"Pity, * was in mood for that. So...any other suggestions?"
4290,1.6941,19,"Hey mr whats the name of that bill brison book the one about language and words"
65,1.6941,12,"Ok lar i double check wif da hair dresser already he said wun cut v short. He said will cut until i look nice."
664,1.6941,13,"Sorry me going home first... Daddy come fetch ü later..."
1696,1.6941,13,"Ü eatin later but i'm eatin wif my frens now lei... Ü going home first?"
2758,1.6941,19,"Have a good trip. Watch out for . Remember when you get back we must decide about easter."
5401,1.6941,19,"HARD BUT TRUE: How much you show &amp;  express your love to someone....that much it will hurt when they leave you or you get seperated...!鈥┾??〨ud evening..."
588,1.6941,18,"I dun thk i'll quit yet... Hmmm, can go jazz ? Yogasana oso can... We can go meet em after our lessons den..."
2162,1.6941,13,"No. Its not specialisation. Can work but its slave labor. Will look for it this month sha cos no shakara 4 beggar."
1020,1.6940,13,"Nope watching tv at home... Not going out. V bored..."
1157,1.6940,1,"Sorry man, accidentally left my phone on silent last night and didn't check it til I got up"
1421,1.6940,1,"Speak only when you feel your words are better than the silence... Gud mrng:-)"
1898,1.6940,4,"I tot u outside cos darren say u come shopping. Of course we nice wat. We jus went sim lim look at mp3 player."
2194,1.6940,15,"Congrats ! Treat pending.i am not on mail for 2 days.will mail once thru.Respect mother at home.check mails."
3492,1.6940,1,"Huh but i got lesson at 4 lei n i was thinkin of going to sch earlier n i tot of parkin at kent vale..."
3932,1.6940,1,"I thk ü gotta go home by urself. Cos i'll b going out shopping 4 my frens present."
4940,1.6940,1,"No it was cancelled yeah baby! Well that sounds important so i understand my darlin give me a ring later on this fone love Kate x"
1618,1.6940,1,"K, makes sense, btw carlos is being difficult so you guys are gonna smoke while I go pick up the second batch and get gas"
2457,1.6940,4,"Abeg, make profit. But its a start. Are you using it to get sponsors for the next event?"
3652,1.6940,1,"We are hoping to get away by 7, from Langport. You still up for town tonight?"
4943,1.6940,1,"Omg you can make a wedding chapel in frontierville? Why do they get all the good stuff?"
5104,1.6940,17,"In other news after hassling me to get him weed for a week andres has no money. HAUGHAIGHGTUJHYGUJ"
3910,1.6939,19,"Sounds like a plan! Cardiff is still here and still cold! I'm sitting on the radiator!"
5198,1.6939,19,"I like cheap! But i‘m happy to splash out on the wine if it makes you feel better.."
5018,1.6938,19,"Hey gals...U all wanna meet 4 dinner at nìte?"
643,1.6938,15,"said kiss, kiss, i can't do the sound effects! He is a gorgeous man isn't he! Kind of person who needs a smile to brighten his day!"
787,1.6938,19,"She was supposed to be but couldn't make it, she's still in town though"
1204,1.6938,15,"Me also da, i feel yesterday night  wait til 2day night dear."
1396,1.6938,19,"R we still meeting 4 dinner tonight?"
1430,1.6938,19,"Tell you what, if you make a little spreadsheet and track whose idea it was to smoke to determine who ""smokes too much"" for the entire month of february, I'll come up"
1960,1.6938,7,"Lol ... Oh no babe, I wont be sliding into your place after midnight, but thanks for the invite"
3370,1.6938,19,"Hey elaine, is today's meeting still on?"
3383,1.6938,15,"complimentary 4 STAR Ibiza Holiday or £10,000 cash needs your URGENT collection. 09066364349 NOW from Landline not to lose out! Box434SK38WP150PPM18+"
3649,1.6938,19,"Hey babe, my friend had to cancel, still up for a visit ?"
4090,1.6938,19,"He needs to stop going to bed and make with the fucking dealing"
4936,1.6938,19,"Hey do you want anything to buy:)"
5154,1.6938,19,"Haven't left yet so probably gonna be here til dinner"
5240,1.6938,14,"Jay wants to work out first, how's 4 sound?"
5477,1.6938,15,"Yes princess! I want to please you every night. Your wish is my command..."
5538,1.6938,15,"Want explicit SEX in 30 secs? Ring 02073162414 now! Costs 20p/min Gsex POBOX 2667 WC1N 3XX"
105,1.6938,19,"wow. You're right! I didn't mean to do that. I guess once i gave up on boston men and changed my search location to nyc, something changed. Cuz on my signin page it still says boston."
982,1.6938,15,"If he started searching he will get job in few days.he have great potential and talent."
1110,1.6938,7,"No you'll just get a headache trying to figure it out. U can trust me to do the math. I promise. O:-)"
1247,1.6938,17,"Hello which the site to download songs its urgent pls"
1936,1.6938,15,"Hope you are having a great day."
2032,1.6938,19,"Ugh y can't u just apologize, admit u were wrong and ask me to take u back?"
2061,1.6938,7,"He didn't see his shadow. We get an early spring yay"
2136,1.6938,15,"If he started searching he will get job in few days.he have great potential and talent."
3665,1.6938,7,"Frnd s not juz a word.....not merely a relationship.....its a silent promise which says ... "" I will be with YOU "" Wherevr.. Whenevr.. Forevr... Gudnyt dear.."
3841,1.6938,7,"Erm … ill pick you up at about 6.45pm. That'll give enough time to get there, park and that."
4533,1.6938,15,"I wish things were different. I wonder when i will be able to show you how much i value you. Pls continue the brisk walks no drugs without askin me please and find things to laugh about. I love you dearly."
4656,1.6938,15,"Hope you are having a great day."
5133,1.6938,15,"it's still not working. And this time i also tried adding zeros. That was the savings. The checking is  &lt;#&gt;"
5359,1.6938,15,"Hmm. Shall i bring a bottle of wine to keep us amused? Just joking! I'll still bring a bottle. Red or white? See you tomorrow"
126,1.6937,4,"Ü predict wat time ü'll finish buying?"
273,1.6937,15,"Night has ended for another day, morning has come in a special way. May you smile like the sunny rays and leaves your worries at the blue blue bay."
1265,1.6937,4,"Ok. No wahala. Just remember that a friend in need ..."
1288,1.6937,15,"Night has ended for another day, morning has come in a special way. May you smile like the sunny rays and leaves your worries at the blue blue bay. Gud mrng"
2305,1.6937,4,"Should I tell my friend not to come round til like  &lt;#&gt; ish?"
2826,1.6937,1,"No need to buy lunch for me.. I eat maggi mee.."
3012,1.6937,4,"Imagine Life WITHOUT ME... see.. How fast u are searching me?Don't worry.. l'm always there To disturb U.. Goodnoon..:)"
3183,1.6937,4,"So many people seems to be special at first sight, But only very few will remain special to you till your last sight.. Maintain them till life ends.. take cr da"
3200,1.6937,4,"7 lor... Change 2 suntec... Wat time u coming?"
3477,1.6937,15,"Night has ended for another day, morning has come in a special way. May you smile like the sunny rays and leaves your worries at the blue blue bay. Gud mrng"
3778,1.6937,15,"Ok lor. Msg me b4 u call."
4120,1.6937,12,"Watch lor. I saw a few swatch one i thk quite ok. Ard 116 but i need 2nd opinion leh..."
4353,1.6937,15,"Night has ended for another day, morning has come in a special way. May you smile like the sunny rays and leaves your worries at the blue blue bay. Gud mrng"
4364,1.6937,1,"I can't right this second, gotta hit people up first"
4385,1.6937,1,"No need lar i go engin? Cos my sis at arts today..."
4613,1.6937,4,"Wat time ü finish?"
5178,1.6937,6,"Very strange.  and  are watching the 2nd one now but i'm in bed. Sweet dreams, miss u"
5336,1.6937,1,"No. It's not pride. I'm almost  &lt;#&gt;  years old and shouldn't be takin money from my kid. You're not supposed to have to deal with this stuff. This is grownup stuff--why i don't tell you."
