Document_ID,Risk_Score,Top_Topic,Text
2765,1.5757,15,"Say this slowly.? GOD,I LOVE YOU &amp; I NEED YOU,CLEAN MY HEART WITH YOUR BLOOD.Send this to Ten special people &amp; u c miracle tomorrow, do it,pls,pls do it..."
2814,1.5757,15,"Say this slowly.? GOD,I LOVE YOU &amp; I NEED YOU,CLEAN MY HEART WITH YOUR BLOOD.Send this to Ten special people &amp; u c miracle tomorrow, do it,pls,pls do it..."
804,1.5678,17,"FREE for 1st week! No1 Nokia tone 4 ur mobile every week just txt NOKIA to 8077 Get txting and tell ur mates. www.getzed.co.uk POBox 36504 W45WQ 16+ norm150p/tone"
5142,1.5678,17,"FREE for 1st week! No1 Nokia tone 4 ur mobile every week just txt NOKIA to 8077 Get txting and tell ur mates. www.getzed.co.uk POBox 36504 W45WQ 16+ norm150p/tone"
4729,1.5676,4,"Had your mobile 10 mths? Update to the latest Camera/Video phones for FREE. KEEP UR SAME NUMBER, Get extra free mins/texts. Text YES for a call"
617,1.5669,15,"Happy valentines day I know its early but i have hundreds of handsomes and beauties to wish. So i thought to finish off aunties and uncles 1st..."
877,1.5669,15,"Shop till u Drop, IS IT YOU, either 10K, 5K, £500 Cash or £100 Travel voucher, Call now, 09064011000. NTT PO Box CR01327BT fixedline Cost 150ppm mobile vary"
1090,1.5669,15,"You are awarded a SiPix Digital Camera! call 09061221061 from landline. Delivery within 28days. T Cs Box177. M221BP. 2yr warranty. 150ppm. 16 . p p£3.99"
2171,1.5669,15,"Shop till u Drop, IS IT YOU, either 10K, 5K, £500 Cash or £100 Travel voucher, Call now, 09064011000. NTT PO Box CR01327BT fixedline Cost 150ppm mobile vary"
3003,1.5669,15,"This message is free. Welcome to the new & improved Sex & Dogging club! To unsubscribe from this service reply STOP. msgs@150p 18+only"
3300,1.5669,15,"This message is free. Welcome to the new & improved Sex & Dogging club! To unsubscribe from this service reply STOP. msgs@150p 18 only"
5525,1.5669,15,"You are awarded a SiPix Digital Camera! call 09061221061 from landline. Delivery within 28days. T Cs Box177. M221BP. 2yr warranty. 150ppm. 16 . p p£3.99"
713,1.5668,15,"It just seems like weird timing that the night that all you and g want is for me to come smoke is the same day as when a shitstorm is attributed to me always coming over and making everyone smoke"
1605,1.5668,1,"Have you heard about that job? I'm going to that wildlife talk again tonight if u want2come. Its that2worzels and a wizzle or whatever it is?!"
2207,1.5668,4,"Haha, my legs and neck are killing me and my amigos are hoping to end the night with a burn, think I could swing by in like an hour?"
2276,1.5668,4,"Think I could stop by in like an hour or so? My roommate's looking to stock up for a trip"
2557,1.5668,4,"FreeMSG You have been awarded a FREE mini DIGITAL CAMERA, just reply SNAP to collect your prize! (quizclub Opt out? Stop 80122300p/wk SP:RWM Ph:08704050406)"
3061,1.5668,15,"Dear all, as we know  &lt;#&gt; th is the  &lt;#&gt; th birthday of our loving Gopalettan. We are planning to give a small gift on that day. Those who like to participate in that you are welcome. Please contact our admin team for more details"
4881,1.5668,4,"Yeah just open chat and click friend lists. Then make the list. Easy as pie"
5103,1.5668,4,"This msg is for your mobile content order It has been resent as previous attempt failed due to network error Queries to customersqueries@netvision.uk.com"
5395,1.5668,13,"I dont know exactly could you ask chechi."
519,1.5667,4,"Your credits have been topped up for http://www.bubbletext.com Your renewal Pin is tgxxrz"
2383,1.5667,15,"Best line said in Love: . ""I will wait till the day I can forget u Or The day u realize that u cannot forget me.""... Gn"
3939,1.5667,1,"Yeah, in fact he just asked if we needed anything like an hour ago. When and how much?"
4966,1.5667,4,"Dear Voucher holder Have your next meal on us. Use the following link on your pc 2 enjoy a 2 4 1 dining experiencehttp://www.vouch4me.com/etlp/dining.asp"
5005,1.5667,4,"CDs 4u: Congratulations ur awarded £500 of CD gift vouchers or £125 gift guaranteed & Freeentry 2 £100 wkly draw xt MUSIC to 87066 TnCs www.ldew.com1win150ppmx3age16"
5571,1.5667,4,"The guy did some bitching but I acted like i'd be interested in buying something else next week and he gave it to us for free"
2696,1.5667,4,"Hey sexy buns! What of that day? No word from you this morning on YM ... :-( ... I think of you"
5371,1.5667,4,"dating:i have had two of these. Only started after i sent a text to talk sport radio last week. Any connection do you think or coincidence?"
5385,1.5667,1,"How are you babes. Hope your doing ok. I had a shit nights sleep. I fell asleep at 5.Im knackered and im dreading work tonight. What are thou upto tonight. X"
96,1.5666,4,"Your free ringtone is waiting to be collected. Simply text the password ""MIX"" to 85069 to verify. Get Usher and Britney. FML, PO Box 5249, MK17 92H. 450Ppw 16"
901,1.5666,4,"Your free ringtone is waiting to be collected. Simply text the password ""MIX"" to 85069 to verify. Get Usher and Britney. FML, PO Box 5249, MK17 92H. 450Ppw 16"
932,1.5666,17,"I'm really sorry i won't b able 2 do this friday.hope u can find an alternative.hope yr term's going ok:-)"
2986,1.5666,4,"He said that he had a right giggle when he saw u again! You would possibly be the first person2die from NVQ, but think how much you could for!"
3921,1.5666,1,"I wish! I don't think its gonna snow that much. But it will be more than those flurries we usually get that melt before they hit the ground. Eek! We haven't had snow since &lt;#&gt; before I was even born!"
4100,1.5666,4,"I think just yourself …Thanks and see you tomo"
1355,1.5666,15,"Goodnight, sleep well da please take care pa. Please."
5127,1.5666,15,"To the wonderful Okors, have a great month. We cherish you guys and wish you well each day. MojiBiola"
502,1.5665,4,"Fighting with the world is easy, u either win or lose bt fightng with some1 who is close to u is dificult if u lose - u lose if u win - u still lose."
1460,1.5665,4,"Fighting with the world is easy, u either win or lose bt fightng with some1 who is close to u is dificult if u lose - u lose if u win - u still lose."
1722,1.5665,4,"Fighting with the world is easy, u either win or lose bt fightng with some1 who is close to u is dificult if u lose - u lose if u win - u still lose."
773,1.5665,1,"Lol! U drunkard! Just doing my hair at d moment. Yeah still up 4 tonight. Wats the plan?"
1195,1.5665,4,"Sex up ur mobile with a FREE sexy pic of Jordan! Just text BABE to 88600. Then every wk get a sexy celeb! PocketBabe.co.uk 4 more pics. 16 £3/wk 087016248"
1478,1.5665,6,"I'm watching lotr w my sis dis aft. So u wan 2 meet me 4 dinner at nite a not?"
2273,1.5665,4,"Life spend with someone for a lifetime may be meaningless but a few moments spent with someone who really love you means more than life itself.."
3549,1.5665,4,"Rock yr chik. Get 100's of filthy films &XXX pics on yr phone now. rply FILTH to 69669. Saristar Ltd, E14 9YT 08701752560. 450p per 5 days. Stop2 cancel"
4944,1.5665,1,"I'm eatin now lor, but goin back to work soon... E mountain deer show huh... I watch b4 liao, very nice..."
958,1.5665,19,"Love isn't a decision, it's a feeling. If we could decide who to love, then, life would be much simpler, but then less magical"
2100,1.5665,4,"No dice, art class 6 thru 9 :( thanks though. Any idea what time I should come tomorrow?"
2371,1.5665,4,"A Boy loved a gal. He propsd bt she didnt mind. He gv lv lttrs, Bt her frnds threw thm. Again d boy decided 2 aproach d gal , dt time a truck was speeding towards d gal. Wn it was about 2 hit d girl,d boy ran like hell n saved her. She asked 'hw cn u run so fast?' D boy replied ""Boost is d secret of my energy"" n instantly d girl shouted ""our energy"" n Thy lived happily 2gthr drinking boost evrydy Moral of d story:- I hv free msgs:D;): gud ni8"
2992,1.5665,19,"Love isn't a decision, it's a feeling. If we could decide who to love, then, life would be much simpler, but then less magical"
4095,1.5665,4,"Life is nothing wen v get everything. But ""life is everything wen v miss something "". Real value of people wil be realized only in their absence.... gud mrng"
4434,1.5665,4,"Dont think you need yellow card for uk travel. Ask someone that has gone before. If you do its just  &lt;#&gt; bucks"
4723,1.5665,18,"Yup. Anything lor, if u dun wan it's ok..."
4859,1.5665,1,"Thanks  and ! Or bomb and date as my phone wanted to say!"
4932,1.5665,4,"Hi, the SEXYCHAT girls are waiting for you to text them. Text now for a great night chatting. send STOP to stop this service"
5105,1.5665,4,"A Boy loved a gal. He propsd bt she didnt mind. He gv lv lttrs, Bt her frnds threw thm. Again d boy decided 2 aproach d gal , dt time a truck was speeding towards d gal. Wn it was about 2 hit d girl,d boy ran like hell n saved her. She asked 'hw cn u run so fast?' D boy replied ""Boost is d secret of my energy"" n instantly d girl shouted ""our energy"" n Thy lived happily 2gthr drinking boost evrydy Moral of d story:- I hv free msgs:D;): gud ni8"
1594,1.5664,15,"Will it help if we propose going back again tomorrow"
2307,1.5664,19,"Still in the area of the restaurant. Ill try to come back soon"
4956,1.5664,19,"U coming back 4 dinner rite? Dad ask me so i re confirm wif u..."
436,1.5664,7,"You available now? I'm like right around hillsborough &amp;  &lt;#&gt; th"
4344,1.5664,18,"Ha! I wouldn't say that I just didn't read anything into way u seemed. I don't like 2 be judgemental....i save that for fridays in the pub!"
2279,1.5664,18,"Hello! How r u? Im bored. Inever thought id get bored with the tv but I am. Tell me something exciting has happened there? Anything! =/"
3287,1.5580,19,"They are just making it easy to pay back. I have  &lt;#&gt; yrs to say but i can pay back earlier. You get?"
748,1.5580,15,"I promise to take good care of you, princess. I have to run now. Please send pics when you get a chance. Ttyl!"
1331,1.5580,6,"I dont know what to do to come out of this so only am ask questions like this dont mistake me."
1742,1.5580,14,"UR GOING 2 BAHAMAS! CallFREEFONE 08081560665 and speak to a live operator to claim either Bahamas cruise of£2000 CASH 18+only. To opt out txt X to 07786200117"
1831,1.5580,4,"Hottest pics straight to your phone!! See me getting Wet and Wanting, just for you xx Text PICS to 89555 now! txt costs 150p textoperator g696ga 18 XxX"
1840,1.5580,15,"Hack Chat. Get backdoor entry into 121 chat rooms at a fraction of the cost. Reply NEO69 or call 09050280520, to subscribe 25p pm. DPS, Bcm box 8027 Ldn, wc1n3xx"
2244,1.5580,12,"Nope wif my sis lor... Aft bathing my dog then i can bathe... Looks like it's going 2 rain soon."
3177,1.5580,14,"UR GOING 2 BAHAMAS! CallFREEFONE 08081560665 and speak to a live operator to claim either Bahamas cruise of£2000 CASH 18+only. To opt out txt X to 07786200117"
3431,1.5580,18,"I don't know jack shit about anything or i'd say/ask something helpful but if you want you can pretend that I did and just text me whatever in response to the hypotheticalhuagauahahuagahyuhagga"
4892,1.5580,7,"Sounds like there could be a lot of time spent in that chastity device boy ... *grins* ... Or take your beatings like a good dog. Going to lounge in a nice long bath now ?"
5488,1.5580,4,"2p per min to call Germany 08448350055 from your BT line. Just 2p per min. Check PlanetTalkInstant.com for info & T's & C's. Text stop to opt out"
1814,1.5579,1,"Getting tickets 4 walsall tue 6 th march. My mate is getting me them on sat. ill pay my treat. Want 2 go. Txt bak .Terry"
3866,1.5579,1,"A pure hearted person can have a wonderful smile that makes even his/her enemies to feel guilty for being an enemy.. So catch the world with your smile..:) GOODMORNING &amp; HAVE A SMILEY SUNDAY..:)"
3783,1.5579,1,"Dear friends, sorry for the late information. Today is the birthday of our loving Ar.Praveesh. for more details log on to face book and see. Its his number + &lt;#&gt; . Dont miss a delicious treat."
3956,1.5579,1,"I probably won't eat at all today. I think I'm gonna pop. How was your weekend? Did u miss me?"
408,1.5578,15,"All was well until slightly disastrous class this pm with my fav darlings! Hope day off ok. Coffee wld be good as can't stay late tomorrow. Same time + place as always?"
419,1.5578,4,"FREE entry into our £250 weekly competition just text the word WIN to 80086 NOW. 18 T&C www.txttowin.co.uk"
492,1.5578,13,"Sorry man my account's dry or I would, if you want we could trade back half or I could buy some shit with my credit card"
528,1.5578,4,"Today's Offer! Claim ur £150 worth of discount vouchers! Text YES to 85023 now! SavaMob, member offers mobile! T Cs 08717898035. £3.00 Sub. 16 . Unsub reply X"
802,1.5578,4,"Last Chance! Claim ur £150 worth of discount vouchers today! Text SHOP to 85023 now! SavaMob, offers mobile! T Cs SavaMob POBOX84, M263UZ. £3.00 Sub. 16"
841,1.5578,4,"Last chance 2 claim ur £150 worth of discount vouchers-Text YES to 85023 now!SavaMob-member offers mobile T Cs 08717898035. £3.00 Sub. 16 . Remove txt X or STOP"
851,1.5578,4,"Today's Offer! Claim ur £150 worth of discount vouchers! Text YES to 85023 now! SavaMob, member offers mobile! T Cs 08717898035. £3.00 Sub. 16 . Unsub reply X"
1631,1.5578,3,"Sounds like you have many talents! would you like to go on a dinner date next week?"
2882,1.5578,4,"Last Chance! Claim ur £150 worth of discount vouchers today! Text SHOP to 85023 now! SavaMob, offers mobile! T Cs SavaMob POBOX84, M263UZ. £3.00 Sub. 16"
5496,1.5578,4,"Good afternoon, my love ... How goes your day ? How did you sleep ? I hope your well, my boytoy ... I think of you ..."
5444,1.5509,4,"You have won a guaranteed 32000 award or maybe even £1000 cash to claim ur award call free on 0800 ..... (18+). Its a legitimat efreefone number wat do u think???"
3752,1.5509,4,"Buzz! Hey, my Love ! I think of you and hope your day goes well. Did you sleep in ? I miss you babe. I long for the moment we are together again*loving smile*"
834,1.5507,4,"Dear Voucher Holder, To claim this weeks offer, at you PC please go to http://www.e-tlp.co.uk/expressoffer Ts&Cs apply. To stop texts, txt STOP to 80062"
2095,1.5507,4,"Final Chance! Claim ur £150 worth of discount vouchers today! Text YES to 85023 now! SavaMob, member offers mobile! T Cs SavaMob POBOX84, M263UZ. £3.00 Subs 16"
2474,1.5507,4,"Final Chance! Claim ur £150 worth of discount vouchers today! Text YES to 85023 now! SavaMob, member offers mobile! T Cs SavaMob POBOX84, M263UZ. £3.00 Subs 16"
165,1.5506,15,"-PLS STOP bootydelious (32/F) is inviting you to be her friend. Reply YES-434 or NO-434 See her: www.SMS.ac/u/bootydelious STOP? Send STOP FRND to 62468"
2880,1.5505,4,"Hey Boys. Want hot XXX pics sent direct 2 ur phone? Txt PORN to 69855, 24Hrs free and then just 50p per day. To stop text STOPBCM SF WC1N3XX"
4463,1.5505,1,"Thanks again for your reply today. When is ur visa coming in. And r u still buying the gucci and bags. My sister things are not easy, uncle john also has his own bills so i really need to think about how to make my own money. Later sha."
11,1.5481,1,"I'm gonna be home soon and i don't want to talk about this stuff anymore tonight, k? I've cried enough today."
838,1.5456,15,"Do you want 750 anytime any network mins 150 text and a NEW VIDEO phone for only five pounds per week call 08002888812 or reply for delivery tomorrow"
1123,1.5456,15,"Do you want 750 anytime any network mins 150 text and a NEW video phone for only five pounds per week call 08000776320 now or reply for delivery Tomorrow"
3484,1.5456,15,"Do you want a NEW video phone750 anytime any network mins 150 text for only five pounds per week call 08000776320 now or reply for delivery tomorrow"
1217,1.5377,18,"that would be good … I'll phone you tomo lunchtime, shall I, to organise something?"
1513,1.5377,18,"Oops sorry. Just to check that you don't mind picking me up tomo at half eight from station. Would that be ok?"
44,1.5374,13,"WHO ARE YOU SEEING?"
70,1.5374,13,"I plane to give on this month end."
131,1.5374,15,"K..k:)how much does it cost?"
154,1.5374,15,"Ok... Ur typical reply..."
197,1.5374,15,"Gud mrng dear hav a nice day"
233,1.5374,13,"Dear we are going to our rubber place"
264,1.5374,13,"MY NO. IN LUTON 0125698789 RING ME IF UR AROUND! H*"
347,1.5374,13,"Gudnite....tc...practice going on"
377,1.5374,18,"Can you say what happen"
378,1.5374,13,"You could have seen me..i did't recognise you Face.:)"
469,1.5374,13,"When are you going to ride your bike?"
508,1.5374,13,"Maybe westshore or hyde park village, the place near my house?"
531,1.5374,18,"Jay says that you're a double-faggot"
534,1.5374,13,"Gudnite....tc...practice going on"
543,1.5374,18,"A famous quote : when you develop the ability to listen to 'anything' unconditionally without losing your temper or self confidence, it means you are ......... 'MARRIED'"
544,1.5374,13,"But am going to college pa. What to do. are else ill come there it self. Pa."
562,1.5374,15,"Hi msg me:)i'm in office.."
598,1.5374,15,"Gud mrng dear have a nice day"
601,1.5374,13,"I'm going out to buy mum's present ar."
604,1.5374,15,"Speaking of does he have any cash yet?"
650,1.5374,15,"No prob. I will send to your email."
704,1.5374,18,"What is important is that you prevent dehydration by giving her enough fluids"
714,1.5374,15,"08714712388 between 10am-7pm Cost 10p"
715,1.5374,15,"Save yourself the stress. If the person has a dorm account, just send your account details and the money will be sent to you."
722,1.5374,15,"Oh is it? Send me the address"
731,1.5374,13,"Dunno y u ask me."
733,1.5374,18,"No he didn't. Spring is coming early yay!"
752,1.5374,13,"Do you realize that in about 40 years, we'll have thousands of old ladies running around with tattoos?"
756,1.5374,15,"Realy sorry-i don't recognise this number and am now confused :) who r u please?!"
791,1.5374,15,"Gud mrng dear hav a nice day"
800,1.5374,15,"Ok i msg u b4 i leave my house."
846,1.5374,13,"K.k:)when are you going?"
861,1.5374,18,"Did he just say somebody is named tampa"
866,1.5374,13,"Dude ive been seeing a lotta corvettes lately"
868,1.5374,18,"Same here, but I consider walls and bunkers and shit important just because I never play on peaceful but I guess your place is high enough that it don't matter"
892,1.5374,13,"Why do you ask princess?"
987,1.5374,18,"Carlos says he'll be at mu in  &lt;#&gt;  minutes"
1019,1.5374,15,"Shall i send that exe to your mail id."
1036,1.5374,13,"ZOE IT JUST HIT ME 2 IM FUCKING SHITIN MYSELF IL DEFO TRY MY HARDEST 2 CUM 2MOROW LUV U MILLIONS LEKDOG"
1084,1.5374,15,"Send to someone else :-)"
1107,1.5374,13,"on hen night. Going with a swing"
1136,1.5374,18,"U wake up already? Thanx 4 e tau sar piah it's quite nice."
1181,1.5374,15,"To day class is there are no class."
1240,1.5374,13,"Dear relieved of westonzoyland, all going to plan this end too!"
1255,1.5374,18,"Mum say we wan to go then go... Then she can shun bian watch da glass exhibition..."
1323,1.5374,18,"I wake up long ago already... Dunno, what other thing?"
1332,1.5374,13,"Aight no rush, I'll ask jay"
1363,1.5374,18,"Shuhui say change 2 suntec steamboat? U noe where? Where r u now?"
1371,1.5374,13,"Did you try making another butt."
1383,1.5374,15,"We spend our days waiting for the ideal path to appear in front of us.. But what we forget is.. ""paths are made by walking.. not by waiting.."" Goodnight!"
1403,1.5374,15,"Kaiez... Enjoy ur tuition... Gee... Thk e second option sounds beta... I'll go yan jiu den msg u..."
1443,1.5374,13,"Ya:)going for restaurant.."
1452,1.5374,15,"Msg me when rajini comes."
1612,1.5374,13,"I'll probably be around mu a lot"
1662,1.5374,15,"No just send to you. Bec you in temple na."
1738,1.5374,15,"I will come tomorrow di"
1787,1.5374,18,"I dun believe u. I thk u told him."
1811,1.5374,13,"Aight, I'll ask a few of my roommates"
1885,1.5374,13,"Come to me, slave. Your doing it again ... Going into your shell and unconsciously avoiding me ... You are making me unhappy :-("
1929,1.5374,13,"Omg it could snow here tonite!"
1956,1.5374,13,"Good night. Am going to sleep."
2005,1.5374,13,"S....s...india going to draw the series after many years in south african soil.."
2012,1.5374,13,"Dunno lei... I thk mum lazy to go out... I neva ask her yet..."
2031,1.5374,18,"Thanx but my birthday is over already."
2039,1.5374,15,"Oh sorry please its over"
2043,1.5374,18,"Ü dun wan to watch infernal affair?"
2047,1.5374,18,"Okay... I booked all already... Including the one at bugis."
2064,1.5374,15,"Is there any training tomorrow?"
2069,1.5374,18,"Who's there say hi to our drugdealer"
2119,1.5374,15,"Wish u many many returns of the day.. Happy birthday vikky.."
2174,1.5374,15,"Yavnt tried yet and never played original either"
2188,1.5374,18,"So is there anything specific I should be doing with regards to jaklin or what because idk what the fuck"
2197,1.5374,15,"V-aluable. A-ffectionate. L-oveable. E-ternal. N-oble. T-ruthful. I-ntimate. N-atural. E-namous. Happy ""VALENTINES DAY"" in advance"
2241,1.5374,15,"Every day i use to sleep after  &lt;#&gt;  so only."
2243,1.5374,18,"U buy newspapers already?"
2303,1.5374,18,"&lt;#&gt; , that's all? Guess that's easy enough"
2311,1.5374,18,"I have 2 sleeping bags, 1 blanket and paper and  phone details. Anything else?"
2330,1.5374,15,"That day you asked about anand number. Why:-)"
2354,1.5374,15,"Thats cool. How was your day?"
2376,1.5374,18,"Dunno lei he neva say..."
2405,1.5374,18,"Jesus christ bitch I'm trying to give you drugs answer your fucking phone"
2406,1.5374,15,"Please give it 2  or i will pick it up on Tuesday evening about 8 if that is ok."
2499,1.5374,15,"Dai what this da.. Can i send my resume to this id."
2516,1.5374,15,"Ok ill send you with in  &lt;DECIMAL&gt;  ok."
2521,1.5374,13,"Ok. I only ask abt e movie. U wan ktv oso?"
2528,1.5374,15,"Do u noe how 2 send files between 2 computers?"
2530,1.5374,18,"jay says he'll put in  &lt;#&gt;"
2563,1.5374,13,"And maybe some pressies"
2577,1.5374,13,"Now thats going to ruin your thesis!"
2610,1.5374,18,"Hello madam how are you ?"
2674,1.5374,15,"Super msg da:)nalla timing."
2691,1.5374,15,"Ya ok, vikky vl c witin  &lt;#&gt; mins and il reply u.."
2699,1.5374,15,"Can you use foreign stamps for whatever you send them off for?"
2735,1.5374,13,"Do ü noe if ben is going?"
2757,1.5374,18,"We r outside already."
2778,1.5374,15,"Send me your id and password"
2805,1.5374,15,"FreeMsg>FAV XMAS TONES!Reply REAL"
2841,1.5374,13,"Easy mate, * guess the quick drink was bit ambitious."
2879,1.5374,18,"twenty past five he said will this train have been to durham already or not coz i am in a reserved seat"
2899,1.5374,13,"Ü collecting ur laptop then going to configure da settings izzit?"
2924,1.5374,15,"I've not sent it. He can send me."
2927,1.5374,15,"Are you coming to day for class."
2930,1.5374,18,"Anything..."
2962,1.5374,15,"Sir send to group mail check it."
2966,1.5374,13,"Do you ever notice that when you're driving, anyone going slower than you is an idiot and everyone driving faster than you is a maniac?"
2967,1.5374,15,"Not yet had..ya sapna aunty manege y'day hogidhe..chinnu full weak and swalpa black agidhane.."
3019,1.5374,18,"One of the joys in lifeis waking up each daywith thoughts that somewhereSomeone cares enough tosend a warm morning greeting.. -"
3062,1.5374,15,"K..k...from tomorrow onwards started ah?"
3063,1.5374,18,"What u talking bout early morning? It's almost noon where your at!"
3162,1.5374,15,"How much did ur hdd casing cost."
3172,1.5374,15,"Mah b, I'll pick it up tomorrow"
3187,1.5374,13,"MAYBE IF YOU WOKE UP BEFORE FUCKING 3 THIS WOULDN'T BE A PROBLEM."
3201,1.5374,13,"No de.am seeing in online shop so that i asked."
3253,1.5374,13,"I‘ll leave around four, ok?"
3255,1.5374,13,"K:)k..its good:)when are you going?"
3316,1.5374,13,"Oh gei. That happend to me in tron. Maybe ill dl it in 3d when its out"
3321,1.5374,18,"Kay... Since we are out already"
3357,1.5374,15,"Minimum walk is 3miles a day."
3362,1.5374,15,"Please attend the phone:)"
3514,1.5374,18,"Already one guy loving you:-."
3525,1.5374,13,"Try neva mate!!"
3529,1.5374,15,"Should i send you naughty pix? :)"
3540,1.5374,15,"We are pleased to inform that your application for Airtel Broadband is processed successfully. Your installation will happen within 3 days."
3545,1.5374,15,"I'm e person who's doing e sms survey..."
3559,1.5374,18,"I had it already..sabarish asked me to go.."
3592,1.5374,13,"I am in escape theatre now. . Going to watch KAVALAN in a few minutes"
3593,1.5374,15,"How much would it cost to hire a hitman"
3603,1.5374,18,"Jay told me already, will do"
3625,1.5374,15,"Damn, poor zac doesn't stand a chance"
3686,1.5374,18,"Dad says hurry the hell up"
3734,1.5374,15,"Gud mrng dear hav a nice day"
3754,1.5374,18,"Why are u up so early?"
3761,1.5374,15,"GOD ASKED, ""What is forgiveness?"" A little child gave lovely reply, ""It is d wonderful fruit that a tree gives when it is being hurt by a stone.. Good night......"
3765,1.5374,15,"K.i will send in  &lt;#&gt;  min:)"
3839,1.5374,18,"Early bird! Any purchases yet?"
3858,1.5374,15,"I'm ok. Will do my part tomorrow"
3901,1.5374,18,"Ü mean it's confirmed... I tot they juz say oni... Ok then..."
3927,1.5374,18,"As if i wasn't having enough trouble sleeping."
3930,1.5374,13,"Babe ? I lost you ... Will you try rebooting ?"
3938,1.5374,15,"They r giving a second chance to rahul dengra."
3949,1.5374,18,"Sorry, went to bed early, nightnight"
3959,1.5374,15,"Where is that one day training:-)"
3961,1.5374,15,"Have a nice day my dear."
3976,1.5374,13,"Roger that. We‘re probably going to rem in about 20"
4020,1.5374,15,"GRAN ONLYFOUND OUT AFEW DAYS AGO.CUSOON HONI"
4099,1.5374,13,"i am going to bed now prin"
4101,1.5374,18,"If u dun drive then how i go 2 sch."
4144,1.5374,13,"Infact happy new year. How are you where are you when are we seeing"
