Document_ID,Risk_Score,Top_Topic,Text
3847,1.8290,14,"Mmmm.... I cant wait to lick it!"
3864,1.8290,14,"Customer place, i wil cal u sir."
3923,1.8290,14,"Do 1 thing! Change that sentence into: ""Because i want 2 concentrate in my educational career im leaving here.."""
3987,1.8290,14,"Whatever, juliana. Do whatever you want."
4097,1.8290,14,"I ain't answerin no phone at what is actually a pretty reasonable hour but I'm sleepy"
4111,1.8290,14,"I want to lick your pussy now..."
4211,1.8290,14,"I want kfc its Tuesday. Only buy 2 meals ONLY 2. No gravy. Only 2 Mark. 2!"
4441,1.8290,14,"i want to grasp your pretty booty :)"
4494,1.8290,14,"Probably a couple hours tops"
4506,1.8290,14,"She told to hr that he want posting in chennai:)because i'm working here:)"
4741,1.8290,14,"We have pizza if u want"
4838,1.8290,14,"Yay can't wait to party together!"
4962,1.8290,14,"I want  &lt;#&gt;  rs da:)do you have it?"
5036,1.8290,14,"I want to go to perumbavoor"
5047,1.8290,14,"We have sent JD for Customer Service cum Accounts Executive to ur mail id, For details contact us"
5214,1.8290,14,"3 pa but not selected."
5377,1.8290,14,"I don't want you to leave. But i'm barely doing what i can to stay sane. fighting with you constantly isn't helping."
5397,1.8290,14,"As in i want custom officer discount oh."
5445,1.8290,14,"Good morning. At the repair shop--the ONLY reason i'm up at this hour."
5475,1.8290,14,"Where's mummy's boy ? Is he being good or bad ? Is he being positive or negative ? Why is mummy being made to wait? Hmmmm?"
5508,1.8290,14,"I want to be inside you every night..."
120,1.8287,4,"Hmm...my uncle just informed me that he's paying the school directly. So pls buy food."
342,1.8287,4,"Ok that's great thanx a lot."
597,1.8287,4,"I am great! How are you?"
736,1.8287,4,"Leaving to qatar tonite in search of an opportunity.all went fast.pls add me in ur prayers dear.Rakhesh"
893,1.8287,4,"I am great princess! What are you thinking about me? :)"
1011,1.8287,4,"Dear Hero,i am leaving to qatar tonite for an apt opportunity.pls do keep in touch at  &lt;EMAIL&gt; ,kerala"
1026,1.8287,4,"Hasn't that been the pattern recently crap weekends?"
1162,1.8287,4,"You sure your neighbors didnt pick it up"
1496,1.8287,4,"It has everything to do with the weather. Keep extra warm. Its a cold but nothing serious. Pls lots of vitamin c"
1640,1.8287,4,"Great comedy..cant stop laughing da:)"
1784,1.8287,4,"My uncles in Atlanta. Wish you guys a great semester."
2086,1.8287,4,"How are you. Wish you a great semester"
2201,1.8287,4,"Not sure I have the stomach for it ..."
2513,1.8287,4,"Er yep sure. Props?"
2657,1.8287,4,"Great! I have to run now so ttyl!"
2686,1.8287,4,"Yupz... I've oredi booked slots 4 my weekends liao..."
3040,1.8287,4,"You are not bothering me but you have to trust my answers. Pls."
3126,1.8287,4,"My uncles in Atlanta. Wish you guys a great semester."
3197,1.8287,4,"Great. P diddy is my neighbor and comes for toothpaste every morning"
3298,1.8287,4,"Hi there. We have now moved in2 our pub . Would be great 2 c u if u cud come up."
3356,1.8287,4,"R u sure they'll understand that! Wine * good idea just had a slurp!"
3481,1.8287,4,"Be sure to check your yahoo email. We sent photos yesterday"
3610,1.8287,4,"Pls come quick cant bare this."
3679,1.8287,4,"Great! So what attracts you to the brothas?"
3888,1.8287,4,"Same, I'm at my great aunts anniversary party in tarpon springs"
4359,1.8287,4,"HELLOGORGEOUS, HOWS U? MY FONE WAS ON CHARGE LST NITW WEN U TEXD ME. HOPEU AD A NICE WKEND AS IM SURE U DID LOOKIN 4WARD 2 C-IN U 2MRW LUV JAZ"
4376,1.8287,4,"K and you're sure I don't have to have consent forms to do it :V"
4488,1.8287,4,"have * good weekend."
4516,1.8287,4,"Sure, whenever you show the fuck up &gt;:("
4720,1.8287,4,"My uncles in Atlanta. Wish you guys a great semester."
4797,1.8287,4,"Saw Guys and Dolls last night with Patrick Swayze it was great"
5147,1.8287,4,"Oh unintentionally not bad timing. Great. Fingers  the trains play along! Will give fifteen min warning."
5405,1.8287,4,"Pls give her prometazine syrup. 5mls then  &lt;#&gt; mins later feed."
931,1.8196,4,"money!!! you r a lucky winner ! 2 claim your prize text money 2 88600 over £1million to give away ! ppt150x3+normal text rate box403 w1t1jy"
136,1.8196,14,"Want 2 get laid tonight? Want real Dogging locations sent direct 2 ur mob? Join the UK's largest Dogging Network bt Txting GRAVEL to 69888! Nt. ec2a. 31p.msg@150p"
475,1.8196,14,"Want 2 get laid tonight? Want real Dogging locations sent direct 2 ur Mob? Join the UK's largest Dogging Network by txting MOAN to 69888Nyt. ec2a. 31p.msg@150p"
1072,1.8196,19,"alright, I'll make sure the car is back tonight"
1379,1.8196,4,"Double Mins & Double Txt & 1/2 price Linerental on Latest Orange Bluetooth mobiles. Call MobileUpd8 for the very latest offers. 08000839402 or call2optout/LF56"
3033,1.8196,10,"gonna let me know cos comes bak from holiday that day.  is coming. Don't4get2text me  number."
3567,1.8196,19,"We know TAJ MAHAL as symbol of love. But the other lesser known facts 1. Mumtaz was Shahjahan's 4th wife, out of his 7 wifes. 2. Shahjahan killed Mumtaz's husband to marry her. 3. Mumtaz died in her  &lt;#&gt; th delivery. 4. He then married Mumtaz's sister. Question arises where the Hell is the LOVE?:-| -The Great Hari-"
4721,1.8196,12,"Aiyo... Her lesson so early... I'm still sleepin, haha... Okie, u go home liao den confirm w me lor..."
5056,1.8196,4,"Double Mins & Double Txt & 1/2 price Linerental on Latest Orange Bluetooth mobiles. Call MobileUpd8 for the very latest offers. 08000839402 or call2optout/LF56"
919,1.8196,4,"When people see my msgs, They think Iam addicted to msging... They are wrong, Bcoz They don\'t know that Iam addicted to my sweet Friends..!! BSLVYL"
3051,1.8196,4,"Lol they don't know about my awesome phone. I could click delete right now if I want."
3169,1.8196,4,"When people see my msgs, They think Iam addicted to msging... They are wrong, Bcoz They don\'t know that Iam addicted to my sweet Friends..!! BSLVYL"
3313,1.8195,1,"HI DARLIN HOW WAS WORK DID U GET INTO TROUBLE? IJUST TALKED TO YOUR MUM ALL MORNING! I HAD A REALLY GOOD TIME LAST NIGHT IM GOIN OUT SOON BUT CALL ME IF U CAN"
824,1.8194,4,"SMSSERVICES. for yourinclusive text credits, pls goto www.comuk.net login= 3qxj9 unsubscribe with STOP, no extra charge. help 08702840625.COMUK. 220-CM2 9AE"
1522,1.8194,4,"URGENT! Your Mobile No was awarded a £2,000 Bonus Caller Prize on 1/08/03! This is our 2nd attempt to contact YOU! Call 0871-4719-523 BOX95QU BT National Rate"
2955,1.8194,4,"URGENT! Your mobile was awarded a £1,500 Bonus Caller Prize on 27/6/03. Our final attempt 2 contact U! Call 08714714011"
4058,1.8194,17,"Ha ha nan yalrigu heltini..Iyo kothi chikku, u shared many things wit me..so far i didn't told any body and even uttered a word abt u.. If ur trusting me so much how can i tell these to others.. Plz nxt time dont use those words to me..ok, chikku:-);-)B-)"
5153,1.8194,19,"Idk. I'm sitting here in a stop and shop parking lot right now bawling my eyes out because i feel like i'm a failure in everything. Nobody wants me and now i feel like i'm failing you."
4204,1.8190,15,"Are you happy baby ? Are you alright ? Did you take that job ? I hope your fine. I send you a kiss to make you smile from across the sea ... *kiss* *kiss*"
2616,1.8145,10,"Sir, hope your day is going smoothly. i really hoped i wont have to bother you about this. I have some bills that i can't settle this month. I am out of all extra cash. I know this is a challenging time for you also but i have to let you know."
1610,1.8068,19,"Are your freezing ? Are you home yet ? Will you remember to kiss your mom in the morning? Do you love me ? Do you think of me ? Are you missing me yet ?"
45,1.8067,17,"Great! I hope you like your man well endowed. I am  &lt;#&gt;  inches..."
694,1.8067,2,"My sister in law, hope you are having a great month. Just saying hey. Abiola"
1798,1.8067,1,"Hey, can you tell me blake's address? Carlos wanted me to meet him there but I got lost and he's not answering his phone"
4596,1.8067,7,"I had a good time too. Its nice to do something a bit different with my weekends for a change. See ya soon"
615,1.8067,1,"THANX4 TODAY CER IT WAS NICE 2 CATCH UP BUT WE AVE 2 FIND MORE TIME MORE OFTEN OH WELL TAKE CARE C U SOON.C"
1735,1.8066,14,"Hi, this is Mandy Sullivan calling from HOTMIX FM...you are chosen to receive £5000.00 in our Easter Prize draw.....Please telephone 09041940223 to claim before 29/03/05 or your prize will be transferred to someone else...."
2621,1.8066,15,"<Forwarded from 21870000>Hi - this is your Mailbox Messaging SMS alert. You have 40 matches. Please call back on 09056242159 to retrieve your messages and matches cc100p/min"
3569,1.8066,4,"Collect your VALENTINE'S weekend to PARIS inc Flight & Hotel + £200 Prize guaranteed! Text: PARIS to No: 69101. www.rtf.sphosting.com"
4133,1.8066,19,"Its Ur luck to Love someone. Its Ur fortune to Love the one who Loves U. But, its a miracle to Love a person who can't Love anyone except U... Gud nyt..."
232,1.8066,7,"Get down in gandhipuram and walk to cross cut road. Right side &lt;#&gt; street road and turn at first right."
2325,1.8066,1,"Sorry dude. Dont know how i forgot. Even after Dan reminded me. Sorry. Hope you guys had fun."
4126,1.8066,19,"Hey sexy buns ! Have I told you ? I adore you, loverboy. I hope you remember to thank your sister in law for those meatballs *grins* ... i love you, babe"
4257,1.8066,4,"Block Breaker now comes in deluxe format with new features and great graphics from T-Mobile. Buy for just £5 by replying GET BBDELUXE and take the challenge"
4350,1.8066,15,"You give us back my id proof and  &lt;#&gt;  rs. We wont allow you to work. We will come to your home within days"
1354,1.8065,4,"Let Ur Heart Be Ur Compass Ur Mind Ur Map Ur Soul Ur Guide And U Will Never loose in world....gnun - Sent via WAY2SMS.COM"
2160,1.8065,4,"I think you should go the honesty road. Call the bank tomorrow. Its the tough decisions that make us great people."
2851,1.8065,4,"YOUR CHANCE TO BE ON A REALITY FANTASY SHOW call now = 08707509020 Just 20p per min NTT Ltd, PO Box 1327 Croydon CR9 5WB 0870 is a national = rate call"
2872,1.8065,4,"YOUR CHANCE TO BE ON A REALITY FANTASY SHOW call now = 08707509020 Just 20p per min NTT Ltd, PO Box 1327 Croydon CR9 5WB 0870 is a national = rate call."
2898,1.8065,4,"pdate_Now - Double mins and 1000 txts on Orange tariffs. Latest Motorola, SonyEricsson & Nokia & Bluetooth FREE! Call MobileUpd8 on 08000839402 or call2optout/!YHL"
3892,1.8065,4,"Double Mins & 1000 txts on Orange tariffs. Latest Motorola, SonyEricsson & Nokia with Bluetooth FREE! Call MobileUpd8 on 08000839402 or call2optout/HF8"
5365,1.8065,4,"Call 09095350301 and send our girls into erotic ecstacy. Just 60p/min. To stop texts call 08712460324 (nat rate)"
4644,1.8065,4,"You are being ripped off! Get your mobile content from www.clubmoby.com call 08717509990 poly/true/Pix/Ringtones/Games six downloads for only 3"
3295,1.8064,19,"A little. Meds say take once every 8 hours. It's only been 5 but pain is back. So I took another. Hope I don't die"
2734,1.8064,7,"How dare you stupid. I wont tell anything to you. Hear after i wont talk to you:-."
5506,1.8064,20,"What i told before i tell. Stupid hear after i wont tell anything to you. You dad called to my brother and spoken. Not with me."
2209,1.8064,2,"Usually the body takes care of it buy making sure it doesnt progress. Can we pls continue this talk on saturday."
94,1.8063,15,"Please call our customer service representative on 0800 169 6031 between 10am-9pm as you have WON a guaranteed £1000 cash or £5000 prize!"
189,1.8063,15,"Please call our customer service representative on FREEPHONE 0808 145 4742 between 9am-11pm as you have WON a guaranteed £1000 cash or £5000 prize!"
1003,1.8063,15,"Please call our customer service representative on FREEPHONE 0808 145 4742 between 9am-11pm as you have WON a guaranteed £1000 cash or £5000 prize!"
1399,1.8063,12,"Then we wait 4 u lor... No need 2 feel bad lar..."
4013,1.8063,15,"Please call our customer service representative on FREEPHONE 0808 145 4742 between 9am-11pm as you have WON a guaranteed £1000 cash or £5000 prize!"
4043,1.8063,15,"Please call our customer service representative on FREEPHONE 0808 145 4742 between 9am-11pm as you have WON a guaranteed £1000 cash or £5000 prize!"
4535,1.8063,14,"Gr8 new service - live sex video chat on your mob - see the sexiest dirtiest girls live on ur phone - 4 details text horny to 89070 to cancel send STOP to 89070"
4629,1.8063,15,"Please call our customer service representative on 0800 169 6031 between 10am-9pm as you have WON a guaranteed £1000 cash or £5000 prize!"
4285,1.8063,4,"Science tells that chocolate will melt under the sunlight. Please don't walk under the sunlight. BCoz,I don't want to loss a sweet friend."
631,1.8062,4,"Todays Vodafone numbers ending with 4882 are selected to a receive a £350 award. If your number matches call 09064019014 to receive your £350 award."
3464,1.8062,4,"Bloomberg -Message center +447797706009 Why wait? Apply for your future http://careers. bloomberg.com"
3756,1.8062,4,"Bloomberg -Message center +447797706009 Why wait? Apply for your future http://careers. bloomberg.com"
4889,1.8062,4,"Todays Vodafone numbers ending with 4882 are selected to a receive a £350 award. If your number matches call 09064019014 to receive your £350 award."
3330,1.8062,4,"No we put party 7 days a week and study lightly, I think we need to draw in some custom checkboxes so they know we're hardcore"
4630,1.7945,4,"Todays Voda numbers ending with 7634 are selected to receive a £350 reward. If you have a match please call 08712300220 quoting claim code 7684 standard rates apply."
4790,1.7944,19,"Thanx. Yup we coming back on sun. Finish dinner going back 2 hotel now. Time flies, we're tog 4 exactly a mth today. Hope we'll haf many more mths to come..."
193,1.7943,2,"I'm sorry. I've joined the league of people that dont keep in touch. You mean a great deal to me. You have been a friend at all times even at great personal cost. Do have a great week.|"
2792,1.7928,4,"U’ve Bin Awarded £50 to Play 4 Instant Cash. Call 08715203028 To Claim. EVERY 9th Player Wins Min £50-£500. OptOut 08718727870"
4947,1.7928,4,"Anyway I don't think I can secure anything up here, lemme know if you want me to drive down south and chill"
448,1.7926,1,"Well done, blimey, exercise, yeah, i kinda remember wot that is, hmm."
2210,1.7926,17,"URGENT!! Your 4* Costa Del Sol Holiday or £5000 await collection. Call 09050090044 Now toClaim. SAE, TC s, POBox334, Stockport, SK38xh, Cost£1.50/pm, Max10mins"
4155,1.7926,17,"URGENT!! Your 4* Costa Del Sol Holiday or £5000 await collection. Call 09050090044 Now toClaim. SAE, TC s, POBox334, Stockport, SK38xh, Cost£1.50/pm, Max10mins"
110,1.7925,10,"I know! Grumpy old people. My mom was like you better not be lying. Then again I am always the one to play jokes..."
3232,1.7925,4,"I feel like a dick because I keep sleeping through your texts and facebook messages. Sup, you in town?"
2180,1.7925,4,"I don,t think so. You don't need to be going out that late on a school night. ESPECIALLY when the one class you have is the one you missed last wednesday and probably failed a test in on friday"
87,1.7924,1,"For real when u getting on yo? I only need 2 more tickets and one more jacket and I'm done. I already used all my multis."
2790,1.7924,4,"Ü got wat to buy tell us then ü no need to come in again."
3326,1.7924,15,"I don wake since. I checked that stuff and saw that its true no available spaces. Pls call the embassy or send a mail to them."
1585,1.7924,10,"It's cool, let me know before it kicks off around  &lt;#&gt; , I'll be out and about all day"
2606,1.7924,1,"You call times job today ok umma and ask them to speed up"
3638,1.7924,10,"ME 2 BABE I FEEL THE SAME LETS JUST 4GET ABOUT IT+BOTH TRY +CHEER UP+NOT FIT SOO MUCHXXLOVE U LOCAXX"
1487,1.7923,1,"(I should add that I don't really care and if you can't I can at least get this dude to fuck off but hey, your money if you want it)"
1541,1.7923,19,"You're not sure that I'm not trying to make xavier smoke because I don't want to smoke after being told I smoke too much?"
176,1.7923,1,"Well, i'm gonna finish my bath now. Have a good...fine night."
873,1.7923,19,"Its going good...no problem..but still need little experience to understand american customer voice..."
2570,1.7923,19,"Hey. For me there is no leave on friday. Wait i will ask my superior and tell you.."
3510,1.7923,17,"Camera quite good, 10.1mega pixels, 3optical and 5digital dooms. Have a lovely holiday, be safe and i hope you hav a good journey! Happy new year to you both! See you in a couple of weeks!"
3848,1.7923,1,"Pls go there today  &lt;#&gt; . I dont want any excuses"
4775,1.7922,4,"Ok then u tell me wat time u coming later lor."
1389,1.7922,1,"Hope ur head doesn't hurt 2 much ! Am ploughing my way through a pile of ironing ! Staying in with a chinky tonight come round if you like."
2000,1.7922,19,"Well, I have to leave for my class babe ... You never came back to me ... :-( ... Hope you have a nice sleep, my love"
2232,1.7922,4,"Hey... Thk we juz go accordin to wat we discussed yest lor, except no kb on sun... Cos there's nt much lesson to go if we attend kb on sat..."
182,1.7922,17,"You lifted my hopes with the offer of money. I am in need. Especially when the end of the month approaches and it hurts my studying. Anyways have a gr8 weekend"
607,1.7922,1,"TaKe CaRE n gET WeLL sOOn"
3972,1.7922,7,"That's the trouble with classes that go well - you're due a dodgey one … Expecting mine tomo! See you for recovery, same time, same place"
2595,1.7921,4,"Tmr timin still da same wat cos i got lesson until 6..."
1580,1.7921,19,"How to Make a girl Happy? It's not at all difficult to make girls happy. U only need to be... 1. A friend 2. Companion 3. Lover 4. Chef . . .  &lt;#&gt; . Good listener  &lt;#&gt; . Organizer  &lt;#&gt; . Good boyfriend  &lt;#&gt; . Very clean  &lt;#&gt; . Sympathetic  &lt;#&gt; . Athletic  &lt;#&gt; . Warm . . .  &lt;#&gt; . Courageous  &lt;#&gt; . Determined  &lt;#&gt; . True  &lt;#&gt; . Dependable  &lt;#&gt; . Intelligent . . .  &lt;#&gt; . Psychologist  &lt;#&gt; . Pest exterminator  &lt;#&gt; . Psychiatrist  &lt;#&gt; . Healer . .  &lt;#&gt; . Stylist  &lt;#&gt; . Driver . . Aaniye pudunga venaam.."
3238,1.7921,4,"Aight text me when you're back at mu and I'll swing by, need somebody to get the door for me"
3342,1.7921,7,"Like I made him throw up when we were smoking in our friend's car one time, it was awesome"
3905,1.7921,7,"Waiting in e car 4 my mum lor. U leh? Reach home already?"
1304,1.7920,4,"FRAN I DECIDED 2 GO N E WAY IM COMPLETELY BROKE AN KNACKERED I GOT UP BOUT 3 C U 2MRW LOVE JANX P.S THIS IS MY DADS FONE, -NO CREDIT"
4337,1.7920,3,"Now u sound like manky scouse boy steve,like! I is travelling on da bus home.wot has u inmind 4 recreation dis eve?"
5534,1.7920,1,"Hey chief, can you give me a bell when you get this. Need to talk to you about this royal visit on the 1st june."
93,1.7920,19,"Smile in Pleasure Smile in Pain Smile when trouble pours like Rain Smile when sum1 Hurts U Smile becoz SOMEONE still Loves to see u Smiling!!"
253,1.7920,15,"Wen ur lovable bcums angry wid u, dnt take it seriously.. Coz being angry is d most childish n true way of showing deep affection, care n luv!.. kettoda manda... Have nice day da."
357,1.7920,7,"Thank You for calling.Forgot to say Happy Onam to you Sirji.I am fine here and remembered you when i met an insurance person.Meet You in Qatar Insha Allah.Rakhesh, ex Tata AIG who joined TISSCO,Tayseer."
734,1.7920,19,"Lol you won't feel bad when I use her money to take you out to a steak dinner =D"
1414,1.7920,15,"Wen ur lovable bcums angry wid u, dnt take it seriously.. Coz being angry is d most childish n true way of showing deep affection, care n luv!.. kettoda manda... Have nice day da."
1509,1.7920,15,"Wen ur lovable bcums angry wid u, dnt take it seriously.. Coz being angry is d most childish n true way of showing deep affection, care n luv!.. kettoda manda... Have nice day da."
2592,1.7920,7,"Lol I have to take it. member how I said my aunt flow didn't visit for 6 months? It's cause I developed ovarian cysts. Bc is the only way to shrink them."
2713,1.7920,15,"Wen ur lovable bcums angry wid u, dnt take it seriously.. Coz being angry is d most childish n true way of showing deep affection, care n luv!.. kettoda manda... Have nice day da."
5226,1.7920,19,"Smile in Pleasure Smile in Pain Smile when trouble pours like Rain Smile when sum1 Hurts U Smile becoz SOMEONE still Loves to see u Smiling!!"
1864,1.7863,1,"The last thing i ever wanted to do was hurt you. And i didn't think it would have. You'd laugh, be embarassed, delete the tag and keep going. But as far as i knew, it wasn't even up. The fact that you even felt like i would do it to hurt you shows you really don't know me at all. It was messy wednesday, but it wasn't bad. The problem i have with it is you HAVE the time to clean it, but you choose not to. You skype, you take pictures, you sleep, you want to go out. I don't mind a few things here and there, but when you don't make the bed, when you throw laundry on top of it, when i can't have a friend in the house because i'm embarassed that there's underwear and bras strewn on the bed, pillows on the floor, that's something else. You used to be good about at least making the bed."
1828,1.7824,1,"Dude. What's up. How Teresa. Hope you have been okay. When i didnt hear from these people, i called them and they had received the package since dec  &lt;#&gt; . Just thot you'ld like to know. Do have a fantastic year and all the best with your reading. Plus if you can really really Bam first aid for Usmle, then your work is done."
2537,1.7824,15,"Can you pls pls send me a mail on all you know about relatives coming to deliver here? All you know about costs, risks, benefits and anything else. Thanks."
297,1.7822,4,"T-Mobile customer you may now claim your FREE CAMERA PHONE upgrade & a pay & go sim card for your loyalty. Call on 0845 021 3680.Offer ends 28thFeb.T&C's apply"
1854,1.7821,4,"This is the 2nd time we have tried 2 contact u. U have won the 750 Pound prize. 2 claim is easy, call 08718726970 NOW! Only 10p per min. BT-national-rate"
3190,1.7821,4,"This is the 2nd time we have tried 2 contact u. U have won the 750 Pound prize. 2 claim is easy, call 08712101358 NOW! Only 10p per min. BT-national-rate"
4384,1.7821,1,"yeah sure thing mate haunt got all my stuff sorted but im going sound anyway promoting hex for .by the way who is this? dont know number. Joke"
4919,1.7821,4,"This is the 2nd time we have tried 2 contact u. U have won the 750 Pound prize. 2 claim is easy, call 08712101358 NOW! Only 10p per min. BT-national-rate"
5568,1.7821,4,"This is the 2nd time we have tried 2 contact u. U have won the £750 Pound prize. 2 claim is easy, call 087187272008 NOW1! Only 10p per minute. BT-national-rate."
990,1.7820,15,"Yun ah.the ubi one say if ü wan call by tomorrow.call 67441233 look for irene.ere only got bus8,22,65,61,66,382. Ubi cres,ubi tech park.6ph for 1st 5wkg days.èn"
2784,1.7820,1,"Well at this right I'm gonna have to get up and check today's steam sales/pee so text me when you want me to come get you"
3519,1.7764,1,"So you think i should actually talk to him? Not call his boss in the morning? I went to this place last year and he told me where i could go and get my car fixed cheaper. He kept telling me today how much he hoped i would come back in, how he always regretted not getting my number, etc."
2040,1.7755,19,"Hey are we going for the lo lesson or gym?"
2391,1.7755,19,"Boo. How's things? I'm back at home and a little bored already :-("
2683,1.7755,19,"I'm on da bus going home..."
2940,1.7755,19,"Hey i've booked the pilates and yoga lesson already... Haha"
4948,1.7755,19,"I'm already back home so no probably not"
432,1.7754,12,"At home watching tv lor."
2191,1.7754,1,"Yup i shd haf ard 10 pages if i add figures... Ü all got how many pages?"
2551,1.7754,1,"Yup but not studying surfing lor. I'm in e lazy mode today."
603,1.7754,12,"If u sending her home first it's ok lor. I'm not ready yet."
3674,1.7754,1,"came to look at the flat, seems ok, in his 50s? * Is away alot wiv work. Got woman coming at 6.30 too."
3539,1.7753,19,"Mmmmm ... It was sooooo good to wake to your words this morning, my Love!! Mmmm fuck ... I love you too, my Lion ... *devouring kiss from across the sea*"
4241,1.7753,19,"Sez, hows u & de arab boy? Hope u r all good give my love 2 evry1 love ya eshxxxxxxxxxxx"
3319,1.7753,17,"No worries, hope photo shoot went well. have a spiffing fun at workage."
3716,1.7753,8,"Oh, i will get paid. The most outstanding one is for a commercial i did for Hasbro...in AUGUST! They made us jump through so many hoops to get paid. Still not."
4837,1.7753,17,"OH RITE. WELL IM WITH MY BEST MATE PETE, WHO I WENT OUT WITH 4 A WEEK+ NOW WERE 2GEVA AGAIN. ITS BEEN LONGER THAN A WEEK."
5443,1.7753,8,"I thought i'd get him a watch, just cos thats the kind of thing u get4an18th. And he loves so much!"
4882,1.7753,1,"alright tyler's got a minor crisis and has to be home sooner than he thought so be here asap"
1012,1.7752,19,"Lol I would but my mom would have a fit and tell the whole family how crazy and terrible I am"
2446,1.7752,17,"Yes but i dont care! I need you bad, princess!"
3453,1.7752,17,"Yes we were outside for like 2 hours. And I called my whole family to wake them up cause it started at 1 am"
4056,1.7752,19,"dont make ne plans for nxt wknd coz she wants us to come down then ok"
490,1.7752,14,"Depends on quality. If you want the type i sent boye, faded glory, then about 6. If you want ralphs maybe 2"
